"Artículo","Tema","Subtema","Categorías","Resumen"
140,Régimen especial de pensiones por riesgo,Menor edad y semanas de cotización para actividades de alto riesgo,"Delegatura exclusiva para supervisión de administradoras de fondos, determinación de actividades de alto riesgo y ajuste de semanas/montos de pensión, régimen de fondos departamentales y municipales para pensiones públicas, adaptación de cajas y fondos privados al sistema vigente, normas sobre emisión y transacción de bonos pensionales, creación de sociedades sin ánimo de lucro para riesgos profesionales, revisión de cotizaciones sobre nómina, régimen jurídico y financiero de sociedades administradoras, Fondo de Actualización Pensional para pensionados anteriores a 1989, consolidación de deuda de la Nación por reservas del ISS, organización del Sistema General de Riesgos Profesionales, consulta con representantes de Congreso, trabajadores y empleadores sobre actividades de alto riesgo, definición de actividades de alto riesgo (ej. custodia penitenciaria), ajuste de edad de jubilación o semanas de cotización, puntos porcentuales adicionales de cotización según actividad","El Gobierno define actividades de alto riesgo para servidores públicos, permitiendo jubilación anticipada o menor número de semanas, y ajusta cotizaciones según riesgo."
141,Mora en pago de pensiones,Intereses sobre mesadas pensionales,"Aplicable desde el 1 de enero de 1994, pago adicional al pensionado de la tasa máxima de interés moratorio vigente","Los pensionados recibirán intereses de mora si las mesadas se pagan con retraso, calculados según la tasa máxima vigente."
142,Mesada adicional para pensionados antiguos,Pago de 30 días de pensión anual,"Pensionados antiguos, Jubilación, Invalidez, Vejez, Sobrevivientes, Reconocidas antes de 1988, Cobro anual en junio desde 1994, Excepción pensionados de vejez nacional (1996), Límite 15 SMLMV","Pensionados antiguos reciben una mesada adicional anual equivalente a 30 días de pensión, respetando topes máximos."
143,Reajuste de pensiones,Ajuste mensual según cotización de salud,"Pensiones reconocidas antes de 1994, Cotización salud a cargo del pensionado, Posible reducción proporcional Consejo Nacional, Gastos de salud 1993 con cargo Seguro IVM","Pensionados previos a 1994 tienen derecho a reajuste mensual de pensión vinculado a cotización de salud, con ajustes especiales según monto y número de beneficiarios."
144,Continuidad de pensiones de sobrevivientes,Reconocimiento a ascendientes de asegurados fallecidos,"Pensiones sobrevivientes reconocidas hasta 1990, Vigencia de condiciones originales","Las pensiones de sobrevivientes reconocidas antes de 1990 mantienen su vigencia y condiciones originales."
145,Financiamiento territorial de pensiones,Fondo mínimo con transferencias adicionales,"Transferencias impuesto de renta, Contribución industria petrolera, Destino mínimo 5% a fondo de pensiones, Inversión de saldos en deuda pública nacional","Entidades territoriales destinan un mínimo del 5% de ciertas transferencias a un fondo para pagar pensiones, con inversión en títulos públicos."
146,Continuidad de disposiciones locales,Derechos pensionales individuales previos a la Ley,"Disposiciones municipales/departamentales, Pensiones extralegales, Derecho a pensionarse en dos años, Vigencia desde sanción de la Ley","Se respetan derechos pensionales individuales establecidos por normas locales antes de la Ley, garantizando continuidad y cumplimiento."
147,Pensión a desmovilizados de procesos de paz,Requisitos y régimen aplicable,"Edad según Ley, Cotización mínima 500 semanas, Régimen Prima Media con Prestación Definida","Desmovilizados de procesos de paz pueden acceder a pensión mínima en el régimen de Prima Media con Prestación Definida, cumpliendo cotización mínima."
148,Pensiones especiales,Beneficio a deportistas olímpicos y campeonatos mundiales,"Deportistas destacados escasos recursos, Juegos Olímpicos, Campeonatos mundiales, Pensión máxima 3 SMLMV, Cumplimiento requisitos legales","Deportistas destacados de escasos recursos pueden recibir pensión especial, limitada a 3 salarios mínimos mensuales."
149,Transferencia de pago de pensiones,Responsabilidad del ISS,"Beneficiarios de EMPOS, Empresas productoras de metales preciosos, ISS asume pensiones y servicios médicos, Transferencias del presupuesto nacional","ISS se encarga de pagar pensiones de beneficiarios de EMPOS y empresas liquidadas, incluyendo servicio médico, con respaldo presupuestal."
150,Reajuste de pensión de funcionarios públicos,Inclusión de sueldos posteriores a resolución de jubilación,"Derecho a reliquidación ingreso base, Sueldos posteriores a jubilación, No obliga retiro antes edad forzosa","Funcionarios pueden actualizar su pensión incluyendo salarios devengados después de notificación de jubilación, sin forzar retiro."
151,Inicio del sistema,Fechas de entrada en vigencia,"Vigencia general 1994, Funcionamiento anticipado administradoras, Servidores públicos departamentales/municipales hasta 1995","El Sistema General de Pensiones entra en vigencia el 1 de abril de 1994, con plazo hasta junio de 1995 para servidores públicos territoriales."
152,Creación del Sistema General de Seguridad Social en Salud,Dirección organización y regulación,"Establecimiento del sistema, Acceso universal, Regulación servicios públicos, Competencias de prestación pública, Marco legal vigente, Excepción medicamentos","La Ley establece el Sistema General de Seguridad Social en Salud, garantizando acceso universal, regulando competencias públicas y privadas y excluyendo medicamentos."
153,Principios rectores del sistema de salud,Normas y valores,"Equidad, Obligatoriedad, Protección integral, Libre escogencia, Autonomía institucional, Descentralización, Participación social, Concertación, Calidad","El sistema se basa en equidad, obligatoriedad, atención integral, libertad de elección, autonomía institucional, descentralización y calidad."
154,Rol del Estado en el sistema de salud,Competencias y objetivos de supervisión,"Garantizar principios constitucionales, Obligatoriedad, Dirección, Coordinación, Control, Ampliación de cobertura, Atención básica gratuita, Descentralización, Uso adecuado de recursos, Asignación prioritaria del gasto","El Estado interviene para garantizar principios, obligatoriedad, control, cobertura progresiva, atención básica gratuita y uso eficiente de recursos."
155,Composición del sistema de salud,Organismos entidades y participantes,"Ministerios de Salud y Trabajo, Consejo Nacional, Superintendencia Salud, EPS, Direcciones seccionales, Fondo de Solidaridad, IPS, Entidades adscritas, Empleadores, Trabajadores, Pensionados, Beneficiarios, Comités comunitarios, ISS funciones","Define los organismos, entidades, empleadores, trabajadores, beneficiarios y comités que integran el sistema, y mantiene funciones específicas del ISS."
156,Funcionamiento y alcance del sistema,Organización afiliación cobertura y financiamiento,"Dirección estatal, Afiliación obligatoria, POS, Recaudo de cotizaciones, EPS administración, UPC, Libre elección EPS e IPS, Asociaciones usuarios, Régimen subsidiado, Fondo de Solidaridad, Consejo Nacional, Financiación territorial, Cobertura universal","El sistema asegura dirección estatal, afiliación obligatoria, Plan Obligatorio de Salud, cobertura subsidiada, Fondo de Solidaridad y participación territorial y comunitaria."
157,Clasificación de participantes,Afiliados y vinculados,"Afiliados régimen contributivo, Afiliados régimen subsidiado, Población prioritaria, Participantes vinculados, Afiliación universal progresiva, Afiliación individual/colectiva, Asociaciones de usuarios, Grupos priorizados al subsidio","Define los tipos de afiliados y vinculados al sistema, diferenciando entre régimen contributivo y subsidiado, asegurando progresiva universalidad."
158,Acceso a beneficios de salud para desmovilizados,Régimen subsidiado temporal,"Desmovilizados procesos de paz, Régimen subsidiado, Cobertura temporal hasta régimen contributivo","Los desmovilizados de procesos de paz tienen derecho a beneficios de salud en el régimen subsidiado hasta que puedan afiliarse al contributivo."
159,Derechos de los afiliados,Acceso atención y participación,"Atención POS, Atención de urgencias, Libre escogencia EPS, Elección IPS y profesionales, Participación en representación y veeduría","Garantiza a los afiliados atención integral, libre elección de EPS e IPS, acceso a urgencias y participación en instancias de control."
160,Obligaciones de los usuarios,Cumplimiento y cuidado en salud,"Cuidado integral de salud, Afiliación familiar, Pago de cotizaciones, Información veraz, Vigilancia empleadores, Cumplimiento normas, Uso racional recursos, Respeto al personal y pacientes","Define las responsabilidades de los afiliados en cuidado de salud, pago de cotizaciones, información veraz, normas y respeto."
161,Obligaciones de los empleadores,Afiliación cotizaciones y ambiente laboral,"Afiliación trabajadores, Financiamiento sistema, Pago aportes, Información novedades, Garantía ambiente seguro, Sanciones incumplimiento","Establece que los empleadores deben afiliar a sus trabajadores, aportar cotizaciones, informar novedades, garantizar condiciones seguras y responder por negligencias."
162,Plan Obligatorio de Salud,Cobertura y contenido,"Acceso universal 2001, Protección integral familias, Promoción prevención diagnóstico tratamiento rehabilitación, Régimen contributivo, Régimen subsidiado, Transición progresiva, Servicios hospitalarios, Actualización periódica, Reaseguro alto costo, Sistema referencia, Urgencias","Establece un POS con protección integral y progresiva, asegurando cobertura hospitalaria, actualización de servicios, reaseguro de alto costo y acceso mediante referencia."
163,Beneficiarios del POS,Cobertura familiar y dependientes,"Cónyuge/compañero permanente, Hijos <18 dependientes, Hijos >18 incapacidad, Hijos <25 estudiantes dependientes, Padres dependientes no pensionados, Inclusión hijos incapacidad, Recién nacidos beneficiarios automáticos, UPC recién nacidos","El POS cubre a cónyuges, hijos y padres dependientes, incluyendo disposiciones especiales para hijos con incapacidad y recién nacidos."
164,Restricciones sobre preexistencias,Acceso a servicios y cotización,"Prohibición preexistencias EPS, Períodos mínimos cotización alto costo (26-100 semanas), Pago según capacidad socioeconómica, Régimen subsidiado sin espera para parto/niños, Sanciones EPS infractoras, Multas Fondo Solidaridad, Reincidencia incremento","Se prohíbe la exclusión por preexistencias, estableciendo períodos mínimos de cotización y regulaciones especiales para parto y menores de un año."
165,Plan de atención complementaria,Intervenciones colectivas e individuales,"Información y educación, Control tabaco/alcohol/drogas, Complementación nutricional, Planificación familiar, Desparasitación escolar, Control vectores, Prevención SIDA/tuberculosis/lepra/malaria, Gratuidad, Obligatoriedad, Financiación fiscal/territorial","Define un plan básico gratuito y obligatorio que complementa el POS, dirigido a intervenciones colectivas de alto impacto, con financiación nacional y territorial."
166,Protección materno infantil,Servicios subsidios y programas,"Control prenatal, Parto, Posparto, Lactancia, Educación salud, Vigilancia crecimiento, Prevención, Atención ambulatoria y hospitalaria, Medicamentos esenciales, Rehabilitación, Subsidio alimentario subsidiado, Programas rurales/adolescentes, Financiación ICBF/Fondo Solidaridad","Garantiza atención integral a gestantes y menores de un año, con servicios de salud, subsidios alimentarios y programas educativos rurales."
167,Cobertura de emergencias especiales,Atención indemnización y financiamiento,"Accidentes tránsito, Actos terroristas, Catástrofes naturales, Servicios médico-quirúrgicos, Indemnización incapacidad/muerte, Gastos funerarios, Transporte, Fondo Solidaridad, SOAT, Reaseguro catastróficos, Reglamentación Gobierno","Asegura cobertura de urgencias y riesgos catastróficos, incluyendo accidentes y desastres, con financiamiento del Fondo de Solidaridad y aseguradoras."
168,Obligación de atención de urgencias,Acceso universal y financiamiento,"Prestación obligatoria pública/privada, Sin contrato u orden, Financiamiento Fondo Solidaridad/EPS, Cobro y tarifas definidas por Gobierno/Consejo Nacional","Todas las instituciones de salud deben prestar urgencias a cualquier persona, con financiación garantizada y regulación de cobros."
169,Planes complementarios,Opciones voluntarias,"Oferta planes EPS, Financiamiento por afiliados, Recursos distintos a cotizaciones, Reajuste sujeto a libertad vigilada Gobierno","Permite a EPS ofrecer planes adicionales al POS, financiados por afiliados, con regulación gubernamental sobre ajustes."
170,Autoridad del sistema,Coordinación con planes nacionales y territoriales,"Gobierno Nacional, Ministerio de Salud, Regulación, Supervisión, Vigilancia, Alineación políticas nacionales, Lucha enfermedades, Educación, Información, Salud, Planes desarrollo, Planes territoriales","El Gobierno y el Ministerio de Salud dirigen y supervisan el sistema, alineándolo con políticas nacionales y planes territoriales."
171,Consejo Nacional de Seguridad Social en Salud,Composición y secretaría,"Ministro de Salud presidente, Ministros Trabajo/Hacienda, Representantes departamentales/municipales, Empleadores, Trabajadores, Pensionados, ISS, EPS, IPS, Profesionales salud, Usuarios rurales, Secretario técnico, Asesores permanentes (Academia, Federación, Facultades, Hospitales), Consejos Territoriales","Define la estructura del Consejo Nacional como órgano de dirección, con representación gubernamental, asesores técnicos y composición análoga en niveles territoriales."
172,Funciones del Consejo Nacional,Atribuciones en POS subsidios UPC,"Definir POS contributivo/subsidiado, Cotizaciones, Valor UPC, Valor subsidios, Medicamentos esenciales, Selección beneficiarios subsidiados, Pagos compartidos, Incapacidades y licencias, Medidas selección adversa, Tarifas riesgos y urgencias, Reglamentación Consejos Territoriales, Fondo Solidaridad administración, Informes anuales Congreso, Reglamento propio, Revisión anual UPC/pagos, Funciones asignadas Ley","El Consejo define políticas, valores y regulaciones del POS, subsidios, UPC, pagos compartidos, supervisa administración del Fondo, regula Consejos y reporta al Congreso."
173,Funciones del Ministerio de Salud,Regulación supervisión coordinación,"Formular políticas con Ministerio Trabajo, Normas científicas calidad, Normas administrativas, Evaluar eficiencia EPS/IPS, Estudios y propuestas para Consejo, Supervisión y control, Información recolección y difusión, Sanciones, Sustitución funciones Ley 10 1990","El Ministerio coordina, regula, supervisa y controla el sistema, establece normas científicas, evalúa eficiencia, elabora estudios y gestiona información."
174,Organización territorial del sistema,Competencias territoriales,"Integración instituciones dirección EPS IPS, Acciones de salud y riesgos, Dirección y organización territorial, Adaptación progresiva servicios oficiales, Ampliación cobertura, Subsidios población vulnerable, Promoción EPS públicas y solidarias, Transformación hospitales IPS, Oferta organizada niveles complejidad, Recursos especiales subsidios, Transición cobertura universal","Establece la integración del sistema de salud territorial, ampliando competencias en dirección, organización y financiación, garantizando subsidios y cobertura progresiva."
175,Órganos asesores locales,Función y creación,"Creación Consejos Territoriales, Asesoría direcciones salud, Planes y programas, Orientación sistemas territoriales, Desarrollo políticas Consejo Nacional","Permite crear Consejos Territoriales que asesoren planes y gestión de salud locales."
176,Funciones de direcciones territoriales,Administración control y supervisión,"Estudios y propuestas para Consejo Territorial, Instrumentos focalización beneficiarios, Administración recursos subsidios, Inspección y vigilancia normas, Protección pasivo prestacional trabajadores salud","Define funciones de direcciones territoriales en planificación, administración de subsidios, supervisión de normas y protección del personal."
177,Concepto de EPS,Funciones principales,"Afiliación y registro, Recaudo cotizaciones, Garantía POS, Gestión financiera, Giro diferencia UPC al Fondo Solidaridad","Las EPS son responsables de afiliar, recaudar y garantizar el POS, transfiriendo al Fondo la diferencia entre cotizaciones y UPC."
178,Funciones de EPS,Afiliación acceso y control,"Delegatarias Fondo Solidaridad, Promover afiliación población no cubierta, Organizar acceso servicios, Garantizar libre acceso IPS, Remitir información al Fondo, Control calidad atención, Funciones asignadas Consejo Nacional","Define funciones de EPS en afiliación, servicios, control de calidad y reporte de información."
179,Campo de acción EPS,Prestación y contratación,"Prestación directa o contratación IPS, Modalidades de pago (capitación, protocolos, presupuestos), Varias alternativas IPS, Agrupamiento riesgos por afiliados/empresas/ubicación","Las EPS pueden prestar o contratar servicios, aplicar modalidades de pago preventivas y agrupar riesgos de manera regulada."
180,Requisitos EPS,Condiciones autorización,"Razón social, Personería jurídica, Objetivos afiliación y gestión, Organización administrativa y financiera, Base de datos afiliados, Capacidad técnica y científica, Evaluación calidad, Número mínimo/máximo afiliados, Margen solvencia, Capital mínimo, Requisitos legales/reglamentarios","Establece los requisitos legales, financieros, técnicos y administrativos para que una entidad sea autorizada como EPS."
181,Tipos de EPS,Entidades autorizadas,"ISS, Cajas y fondos públicos, Asociaciones de cajas compensación, Medicina prepagada/seguros, EPS territoriales, Organismos empresas públicas/privadas, ONG y solidarias, Empresas solidarias de salud, Comunidades indígenas, Entidades privadas EPS, Autonomía IPS propiedad EPS, EPS comunitarias, Reemplazo prestación por contratación","Define los tipos de EPS, incluyendo públicas, privadas, mixtas, solidarias y de prepagada, con reglas de autonomía y promoción comunitaria."
"Artículo 182","Financiamiento de EPS","UPC y manejo de recursos","Cotizaciones pertenecen al sistema, UPC según perfil epidemiológico y costos, Definición de UPC por Consejo Nacional con estudios, Manejo de recursos en cuentas separadas","Regula ingresos de EPS mediante UPC y cotizaciones, estableciendo criterios de cálculo y manejo independiente de recursos."
"Artículo 183","Limitaciones legales a EPS","Afiliación y prácticas restrictivas","Prohibición de terminar afiliación unilateral, No negar afiliación si se paga cotización o subsidio, Reglamentación de eficiencia e inversión, Prohibición de prácticas que limiten libre escogencia","Limita capacidad de EPS de excluir afiliados y prohíbe prácticas que restrinjan libre elección."
"Artículo 184","Incentivos en EPS e IPS","Calidad, eficiencia y racionalización","Incentivos a oferta de servicios, Control de costos, Productividad, Asignación de recursos costo-eficiencia, Incentivos a demanda, Racionalización de referencias, Promoción de calidad en atención","Establece incentivos para EPS e IPS orientados a eficiencia, control de costos, productividad y mejora de calidad."
"Artículo 185","Función y principios de las IPS","Autonomía y obligaciones","Prestación de servicios según nivel de atención, calidad y eficiencia, autonomía administrativa, técnica y financiera, libre concurrencia y acceso a información veraz, prohibición de acuerdos que limiten la competencia, requisitos de constitución según normas del Ministerio de Salud, sistema contable obligatorio para registro de costos y contratación con EPS o entidades territoriales","Define funciones de las IPS, principios de calidad, eficiencia y competencia, y establece la obligación de contar con sistema contable para contratación y tarifas."
"Artículo 186","Evaluación de calidad de IPS","Información y mejoramiento","Conformación de sistema de acreditación, brindar información a usuarios sobre calidad, promover mejoramiento de servicios","Se implementa un sistema de acreditación para garantizar transparencia y calidad de las IPS."
"Artículo 187","Pagos compartidos","Estrategia de acceso y financiación","Cuotas moderadoras y deducibles, racionalización del uso de servicios, complementación del POS, no barreras para población pobre, definición según estratificación socioeconómica y antigüedad de afiliación, recaudos como recurso de EPS, parte destinada a subcuenta de Promoción de Salud","Regula pagos moderadores para racionalizar uso del sistema sin impedir acceso a población vulnerable, con criterios socioeconómicos y destina recursos parcialmente a promoción de salud."
"Artículo 188","Derecho a la atención","Reclamaciones y control","Prohibición de discriminación, reclamaciones ante comité técnico científico de la EPS, nuevo concepto ante dirección seccional en caso de inconformidad, reglamentación por el Gobierno Nacional","Garantiza derechos de los usuarios a atención sin discriminación y establece procedimientos de reclamación y supervisión."
"Artículo 189","Infraestructura hospitalaria","Presupuesto mínimo","Hospitales con más del 30% de ingresos por contratos con nación o entidades territoriales, destinar mínimo 5% del presupuesto a mantenimiento de infraestructura y dotación hospitalaria","Obliga a hospitales públicos y privados con alta dependencia de contratos estatales a invertir en mantenimiento y dotación mínima."
"Artículo 190","Tecnología biomédica","Importación y control","Normas para importación, control de desarrollo de programas de alta tecnología, metodologías de evaluación técnica y económica, localización eficiente de tecnología, aplicable a sector público y privado","Regula importación, evaluación y uso eficiente de tecnología biomédica en todos los sectores."
"Artículo 191","Inversión y dotación de salud","Centros y puestos de salud","Prioridad en asignación de recursos a centros y puestos de salud, dotación básica de equipo y personal según Ministerio, ampliación progresiva de horarios hasta 24 horas, servicio social obligatorio en áreas rurales, definición de dotación y red territorial por Ministerio, control técnico ministerial","Establece prioridades de dotación y fortalecimiento de centros de salud, con control técnico y servicio social en áreas rurales."
"Artículo 192","Nombramiento y régimen de directores","Designación y remoción","Nombramiento por jefe de entidad territorial de terna presentada por junta directiva, períodos mínimos de 3 años prorrogables, remoción por faltas graves, ética o ineficiencia, vigencia desde 31 de marzo de 1995, régimen salarial especial reglamentado por Gobierno Nacional","Regula nombramiento, remoción y régimen salarial de directores de hospitales públicos y empresas sociales del Estado."
"Artículo 193","Estímulos laborales","Incentivos salariales y no salariales","Estímulos salariales y no salariales, educación continua, crédito para instalación, vivienda, transporte, asociación solidaria de profesionales, nivelación salarial gradual 1995-1998, becas-créditos en programas docente-asistenciales, modalidades de contratación por capitación, prima de productividad, incentivos privados regulados por Consejo Nacional","Define incentivos para mejorar desempeño, ubicación en zonas necesitadas, nivelación salarial y becas-créditos para formación y retención de profesionales."
"Artículo 194","Concepto de ESE","Personalidad jurídica y autonomía","Entidades públicas descentralizadas, personería jurídica, patrimonio propio, autonomía administrativa, creadas por Ley o asambleas/concejos, sometidas a régimen especial del capítulo","Establece que la prestación directa de salud por Nación o entidades territoriales se realiza mediante ESE, con autonomía y personería jurídica."
"Artículo 195","Regulación legal y administrativa","Estructura y funcionamiento","Nombre con expresión 'Empresa Social del Estado', objeto: prestación de servicios de salud, junta directiva según Ley 10 de 1990, director nombrado según Artículo 192, empleados públicos, contratación por derecho privado con cláusulas especiales, régimen presupuestal basado en reembolso contra prestación, recepción de transferencias directas, régimen tributario para establecimientos públicos","Establece régimen jurídico de ESE, incluyendo objeto, administración, contratación, presupuesto y tributos."
"Artículo 196","Transformación de entidades","Nivel nacional","Transformación de entidades descentralizadas nacionales de salud en ESE","Todas las entidades descentralizadas del orden nacional para prestación de salud se convierten en Empresas Sociales del Estado."
"Artículo 197","Reestructuración de entidades territoriales","Transformación en ESE territoriales","Reestructuración de entidades descentralizadas de prestación de salud, plazo de 6 meses desde vigencia de la Ley, adecuación a régimen de Empresas Sociales del Estado","Obliga a entidades territoriales a reorganizar sus entidades descentralizadas de salud para constituir ESE en un plazo determinado."
